
> solo-tutor@1.0.0 test:db
> bash scripts/test-db.sh

CREATE ROLE
CREATE ROLE
CREATE ROLE
CREATE SCHEMA
CREATE TABLE
CREATE FUNCTION
GRANT
GRANT
GRANT ROLE
CREATE EXTENSION
CREATE TABLE
INSERT 0 0
CREATE FUNCTION
CREATE TRIGGER
REVOKE
CREATE TABLE
CREATE TABLE
CREATE TABLE
CREATE TABLE
CREATE TABLE
CREATE TABLE
CREATE TABLE
CREATE TABLE
ALTER TABLE
ALTER TABLE
ALTER TABLE
ALTER TABLE
ALTER TABLE
ALTER TABLE
ALTER TABLE
ALTER TABLE
ALTER TABLE
CREATE POLICY
CREATE POLICY
CREATE POLICY
CREATE POLICY
CREATE POLICY
CREATE POLICY
CREATE POLICY
REVOKE
GRANT
GRANT
GRANT
CREATE VIEW
REVOKE
GRANT
CREATE FUNCTION
CREATE FUNCTION
CREATE FUNCTION
CREATE FUNCTION
CREATE FUNCTION
CREATE FUNCTION
CREATE FUNCTION
REVOKE
REVOKE
REVOKE
REVOKE
REVOKE
GRANT
GRANT
GRANT
REVOKE
REVOKE
GRANT
GRANT
GRANT
GRANT
ALTER TABLE
GRANT
ALTER TABLE
CREATE TABLE
CREATE TABLE
ALTER TABLE
ALTER TABLE
CREATE POLICY
CREATE POLICY
REVOKE
GRANT
GRANT
CREATE FUNCTION
CREATE FUNCTION
CREATE FUNCTION
CREATE FUNCTION
CREATE FUNCTION
CREATE FUNCTION
DROP FUNCTION
CREATE FUNCTION
DROP VIEW
CREATE VIEW
REVOKE
GRANT
REVOKE
REVOKE
REVOKE
REVOKE
REVOKE
REVOKE
GRANT
GRANT
GRANT
GRANT
GRANT
GRANT
CREATE TABLE
ALTER TABLE
REVOKE
GRANT
CREATE TABLE
ALTER TABLE
REVOKE
GRANT
CREATE INDEX
CREATE FUNCTION
REVOKE
GRANT
CREATE TABLE
ALTER TABLE
REVOKE
GRANT
CREATE INDEX
CREATE INDEX
CREATE VIEW
REVOKE
GRANT
CREATE TABLE
ALTER TABLE
CREATE POLICY
REVOKE
GRANT
GRANT
CREATE FUNCTION
REVOKE
GRANT
CREATE FUNCTION
REVOKE
GRANT
ALTER TABLE
GRANT
CREATE TABLE
CREATE INDEX
ALTER TABLE
CREATE POLICY
REVOKE
GRANT
GRANT
CREATE FUNCTION
CREATE FUNCTION
CREATE FUNCTION
REVOKE
GRANT
CREATE FUNCTION
REVOKE
GRANT
CREATE FUNCTION
CREATE FUNCTION
REVOKE
REVOKE
GRANT
GRANT
CREATE FUNCTION
CREATE FUNCTION
REVOKE
REVOKE
GRANT
GRANT
INSERT 0 1
INSERT 0 1
ALTER TABLE
CREATE INDEX
CREATE TABLE
ALTER TABLE
REVOKE
GRANT
CREATE FUNCTION
REVOKE
GRANT
CREATE FUNCTION
REVOKE
GRANT
CREATE INDEX
CREATE TABLE
ALTER TABLE
REVOKE
GRANT
INSERT 0 1
CREATE FUNCTION
CREATE FUNCTION
CREATE VIEW
REVOKE
GRANT
CREATE VIEW
REVOKE
GRANT
DO
DELETE 1
CREATE FUNCTION
REVOKE
CREATE TRIGGER
ALTER TABLE
ALTER TABLE
ALTER TABLE
COMMENT
CREATE FUNCTION
REVOKE
CREATE FUNCTION
REVOKE
GRANT
CREATE VIEW
COMMENT
REVOKE
GRANT
CREATE VIEW
COMMENT
REVOKE
GRANT
CREATE TABLE
CREATE INDEX
CREATE INDEX
ALTER TABLE
REVOKE
GRANT
CREATE FUNCTION
CREATE TRIGGER
REVOKE
CREATE FUNCTION
REVOKE
GRANT
CREATE FUNCTION
REVOKE
GRANT
CREATE VIEW
COMMENT
REVOKE
GRANT
CREATE VIEW
COMMENT
REVOKE
GRANT
BEGIN
 recent_client_errors
----------------------
                    0
(1 row)

 stale_plan_requests
---------------------
                   0
(1 row)

 manual_review_outbox | stale_processing_outbox | stale_queued_outbox
----------------------+-------------------------+---------------------
                    0 |                       0 |                   0
(1 row)

DO
COMMIT
INSERT 0 2
DO
INSERT 0 2
INSERT 0 2
INSERT 0 2
SET
              set_config
--------------------------------------
 10000000-0000-0000-0000-000000000001
(1 row)

DO
 set_config
------------
 339212
(1 row)

DO
              set_config
--------------------------------------
 25450d2a-0349-4bbb-b509-a9119bb5897d
(1 row)

DO
RESET
INSERT 0 2
SET
              set_config
--------------------------------------
 10000000-0000-0000-0000-000000000001
(1 row)

DO
RESET
SET
              set_config
--------------------------------------
 10000000-0000-0000-0000-000000000001
(1 row)

              set_config
--------------------------------------
 04f5b638-801d-42a0-8b62-9b0969972fb3
(1 row)

              set_config
--------------------------------------
 04f5b638-801d-42a0-8b62-9b0969972fb3
(1 row)

DO
RESET
SET
              set_config
--------------------------------------
 20000000-0000-0000-0000-000000000002
(1 row)

DO
RESET
SET
 replace_line_channel
----------------------

(1 row)

RESET
DO
UPDATE 1
SET
              set_config
--------------------------------------
 10000000-0000-0000-0000-000000000001
(1 row)

DO
RESET
UPDATE 1
INSERT 0 1
SET
              set_config
--------------------------------------
 10000000-0000-0000-0000-000000000001
(1 row)

DO
RESET
UPDATE 1
UPDATE 1
SET
              set_config
--------------------------------------
 10000000-0000-0000-0000-000000000001
(1 row)

              set_config
--------------------------------------
 c8a108f7-67de-498b-b4a3-64d23fc4ada1
(1 row)

              set_config
--------------------------------------
 fea6b632-14e1-4235-b0f3-c45feab423de
(1 row)

DO
              set_config
--------------------------------------
 50804ccf-46e3-452a-8e74-131e9debf97a
(1 row)

DO
RESET
UPDATE 1
INSERT 0 2
SET
DO
RESET
UPDATE 1
INSERT 0 1
INSERT 0 1
UPDATE 1
SET
              set_config
--------------------------------------
 10000000-0000-0000-0000-000000000001
(1 row)

DO
RESET
DO
UPDATE 1
INSERT 0 1
SET
              set_config
--------------------------------------
 56bf75b2-3c92-417d-90d0-504e0719bc76
(1 row)

DO
RESET
UPDATE 0
UPDATE 1
INSERT 0 2
SET
DO
RESET
UPDATE 3
UPDATE 1
INSERT 0 1
DO
INSERT 0 1
INSERT 0 1
SET
              set_config
--------------------------------------
 c29241ef-858d-41ac-b9a5-5f0aebd0a74a
(1 row)

              set_config
--------------------------------------
 69de9899-c6aa-45e2-ac36-2d4648efc5de
(1 row)

              set_config
--------------------------------------
 acc0bca0-c237-4d63-ae85-44b7d14b092e
(1 row)

DO
RESET
DO
INSERT 0 1
SET
DO
RESET
UPDATE 1
INSERT 0 1
SET
DO
RESET
UPDATE 1
INSERT 0 1
SET
DO
RESET
SET
              set_config
--------------------------------------
 10000000-0000-0000-0000-000000000001
(1 row)

DO
              set_config
--------------------------------------
 20000000-0000-0000-0000-000000000002
(1 row)

DO
              set_config
--------------------------------------
 10000000-0000-0000-0000-000000000001
(1 row)

DO
RESET
SET
              set_config
--------------------------------------
 10000000-0000-0000-0000-000000000001
(1 row)

DO
RESET
SET
DO
RESET
SET
              set_config
--------------------------------------
 10000000-0000-0000-0000-000000000001
(1 row)

DO
RESET
UPDATE 1
SET
              set_config
--------------------------------------
 10000000-0000-0000-0000-000000000001
(1 row)

DO
              set_config
--------------------------------------
 20000000-0000-0000-0000-000000000002
(1 row)

DO
RESET
DO
SET
DO
RESET
UPDATE 4
SET
DO
RESET
SET
DO
RESET
DO
INSERT 0 2
DO
UPDATE 1
INSERT 0 1
SET
DO
RESET
INSERT 0 2
DO
BEGIN
INSERT 0 3
INSERT 0 3
INSERT 0 2
INSERT 0 4
DO
DELETE 1
DELETE 1
DO
CREATE FUNCTION
CREATE TRIGGER
DO
DROP TRIGGER
SET
              set_config
--------------------------------------
 d1000000-0000-4000-8000-000000000003
(1 row)

DO
RESET
ROLLBACK
BEGIN
INSERT 0 2
INSERT 0 2
DO
SET
DO
DO
RESET
DO
INSERT 0 1
DELETE 1
DO
ROLLBACK
BEGIN
 paid_month | payments | paying_providers | gross_baht | detached_payments
------------+----------+------------------+------------+-------------------
 2026-09-01 |        3 |                1 |       1397 |                 0
 2026-07-01 |        1 |                1 |        299 |                 0
 2026-06-01 |        1 |                1 |        299 |                 0
(3 rows)

 cohort_month | first_month_payers | renewed_in_month_2 | renewal_percent
--------------+--------------------+--------------------+-----------------
 2026-06-01   |                  1 |                  1 |           100.0
(1 row)

 providers | active_pro | providers_opened_last_30_days | ever_paid_and_opened_last_30_days
-----------+------------+-------------------------------+-----------------------------------
         2 |          1 |                             0 |                                 0
(1 row)

COMMIT
BEGIN
 revenue_month | verified_payments | verified_net_positive_providers | verified_gross_baht | verified_refund_baht | verified_net_baht | erased_verified_payments | legacy_unverified_approvals | legacy_unverified_gross_baht
---------------+-------------------+---------------------------------+---------------------+----------------------+-------------------+--------------------------+-----------------------------+------------------------------
 2026-09-01    |                 0 |                               0 |                   0 |                    0 |                 0 |                        0 |                           3 |                         1397
 2026-07-01    |                 0 |                               0 |                   0 |                    0 |                 0 |                        0 |                           1 |                          299
 2026-06-01    |                 0 |                               0 |                   0 |                    0 |                 0 |                        0 |                           1 |                          299
(3 rows)

 verified_payments | net_positive_verified_customers_currently_linked | verified_gross_baht | verified_refund_baht | verified_net_baht | erased_verified_payments | legacy_unverified_approvals | legacy_unverified_gross_baht
-------------------+--------------------------------------------------+---------------------+----------------------+-------------------+--------------------------+-----------------------------+------------------------------
                 0 |                                                0 |                   0 |                    0 |                 0 |                        0 |                           5 |                         1995
(1 row)

 cohort_month | verified_first_month_payers | verified_renewed_in_month_2 | verified_renewal_percent
--------------+-----------------------------+-----------------------------+--------------------------
(0 rows)

 linked_net_positive_verified_customers | opened_last_30_days
----------------------------------------+---------------------
                                      0 |                   0
(1 row)

COMMIT
postgres:17-alpine LINE backend contract tests passed
